{
  "contract_id": "SF-CON-BPMN-PROFILE",
  "contract_status": "FROZEN",
  "freeze_status": "FROZEN",
  "tenant_id": "11111111-1111-4111-8111-111111111111",
  "idempotency_key": "idem-bpmn-0001",
  "invented_statutory_policy_forbidden": true,
  "report_id": "22222222-2222-4222-8222-222222222222",
  "direction": "IMPORT",
  "compatibility_status": "PARTIAL",
  "unsupported_constructs": ["bpmn:AdHocSubProcess"],
  "temporal_remains_runtime": true,
  "canonical_model": "ServiceForm Workflow Model",
  "correlation_id": "33333333-3333-4333-8333-333333333333"
}
